document_modified,term_localName,term_isDefinedBy,term_created,term_modified,term_deprecated,replaces_term,replaces1_term,replaces2_term,label,definition,usage,notes,type,controlled value string,tdwgutility_organizedInClass,equivalentXPath,SKOS_inSchema,tdwgutility_repeatable,examples,database,vann_preferredNamespacePrefix,vann_preferredNamespaceUri
2022-11-08T20:28:25-06:00,Patterns,http://rs.tdwg.org/plic/terms/,2022-11-08,2022-11-08,,,,,Patterns,Displacement of the species in space.,,,http://www.w3.org/2004/02/skos/core#ConceptScheme,,Migratory,/Dataset/TaxonRecord/NaturalHistory/Migratory/MigratoryAtomized/Patterns,,,,plic,plic,http://rs.tdwg.org/plic/terms/
2022-11-08T20:28:25-06:00,Routes,http://rs.tdwg.org/plic/terms/,2022-11-08,2022-11-08,,,,,Routes,Trajectory followed by the species.,,,http://www.w3.org/1999/02/22-rdf-syntax-ns#Property,,Migratory,/Dataset/TaxonRecord/NaturalHistory/Migratory/MigratoryAtomized/Routes,,,,plic,plic,http://rs.tdwg.org/plic/terms/
2022-11-08T20:28:25-06:00,Season,http://rs.tdwg.org/plic/terms/,2022-11-08,2022-11-08,,,,,Season,Time of year in which a species migrates.,,,http://www.w3.org/1999/02/22-rdf-syntax-ns#Property,,Migratory,/Dataset/TaxonRecord/NaturalHistory/Migratory/MigratoryAtomized/Season,,,,plic,plic,http://rs.tdwg.org/plic/terms/
2022-11-08T20:28:25-06:00,RelatedTo,http://rs.tdwg.org/plic/terms/,2022-11-08,2022-11-08,,,,,RelatedTo,Specifies to which PlinianCore term the information contained under MolecularDataAtomized refers to. The controlled vocabulary is list of content-bearing PlinianCore elements.,,,http://www.w3.org/1999/02/22-rdf-syntax-ns#Property,,MolecularData,/Dataset/TaxonRecord/NaturalHistory/Dispersal/DispersalAtomized/Distance/RelatedTo|/Dataset/TaxonRecord/NaturalHistory/Dispersal/DispersalAtomized/Purpose/RelatedTo|/Dataset/TaxonRecord/NaturalHistory/MolecularData/MolecularDataAtomized/RelatedTo,,,,plic,plic,http://rs.tdwg.org/plic/terms/
2022-11-08T20:28:25-06:00,AnnualCycles,http://rs.tdwg.org/plic/terms/,2022-11-08,2022-11-08,,,,,Annual Cycles,"Set of changes or events that recurrently take place at the same time of year and are influenced by seasonal and interannual climate variations. Also called phenology, mainly in plants. In the case of migration, it only makes reference to the timing; other data about this are gathered in MigratoryClass.",,"For example: reproduction, flowering, fruiting, emergence of insects, etc. ",http://www.w3.org/2000/01/rdf-schema#Class,,AnnualCycles,/Dataset/TaxonRecord/NaturalHistory/AnnualCycles,,,,plic,plic,http://rs.tdwg.org/plic/terms/
2022-11-08T20:28:25-06:00,Behavior,http://rs.tdwg.org/plic/terms/,2022-11-08,2022-11-08,,,,,Behavior,"Responses, reactions or movements made by an organism in a particular situation.",,,http://www.w3.org/2000/01/rdf-schema#Class,,Behavior,/Dataset/TaxonRecord/NaturalHistory/Behavior,,,,plic,plic,http://rs.tdwg.org/plic/terms/
2022-11-08T20:28:25-06:00,LifeCycle,http://rs.tdwg.org/plic/terms/,2022-11-08,2022-11-08,,,,,Life Cycle,Life history of a living organism: The course of developmental changes in an organism from fertilized zygote to maturity or stages through which an organism passes.,,,http://www.w3.org/2000/01/rdf-schema#Class,,LifeCycle,/Dataset/TaxonRecord/NaturalHistory/LifeCycle,,,,plic,plic,http://rs.tdwg.org/plic/terms/
2022-11-08T20:28:25-06:00,LifeForm,http://rs.tdwg.org/plic/terms/,2022-11-08,2022-11-08,,,,,Life Form,"General appearance. Characteristic mode of growth or occurrence associated to its environment, particularly for plants. Comprising its size, shape, texture and orientation.",,"Example: tree, shrubs, herbs.",http://www.w3.org/2000/01/rdf-schema#Class,,LifeForm,/Dataset/TaxonRecord/NaturalHistory/LifeForm,,,,plic,plic,http://rs.tdwg.org/plic/terms/
2022-11-08T20:28:25-06:00,MolecularData,http://rs.tdwg.org/plic/terms/,2022-11-08,2022-11-08,,,,,molecular data,"Information on the chemical structures and biological processes at the molecular level: DNA and proteins sequences, protein structures, expression profiles of genes protein domains, families of genes, mutations, polymorphisms, involvement in disease, ...",,"Undeveloped. Placeholder for connecting with standards developed by specialists. For example, Standards for Data Exchange and Management from Scalalife (http://www.scalalife.eu/content/data)",http://www.w3.org/2000/01/rdf-schema#Class,,MolecularData,/Dataset/TaxonRecord/NaturalHistory/MolecularData,,,,plic,plic,http://rs.tdwg.org/plic/terms/
2022-11-08T20:28:25-06:00,Reproduction,http://rs.tdwg.org/plic/terms/,2022-11-08,2022-11-08,,,,,reproduction,All data related to the production of offspring.,,,http://www.w3.org/2000/01/rdf-schema#Class,,Reproduction,/Dataset/TaxonRecord/NaturalHistory/Reproduction,,,,plic,plic,http://rs.tdwg.org/plic/terms/
2022-11-08T20:28:25-06:00,EcologicalSignificance,http://rs.tdwg.org/plic/terms/,2022-11-08,2022-11-08,,,,,Ecological Significance,Ecological importance of the taxon. (Placeholder).,,,http://www.w3.org/2000/01/rdf-schema#Class,,EcologicalSignificance,/Dataset/TaxonRecord/NaturalHistory/EcologicalSignificance,,,,plic,plic,http://rs.tdwg.org/plic/terms/
2022-11-08T20:28:25-06:00,EnvironmentalEnvelope,http://rs.tdwg.org/plic/terms/,2022-11-08,2022-11-08,,,,,Environmental Envelope,"Set of environmental conditions within which it is believed that the species can persist; that is, where its environmental requirements can be satisfied.",,,http://www.w3.org/2000/01/rdf-schema#Class,,EnvironmentalEnvelope,/Dataset/TaxonRecord/NaturalHistory/EnvironmentalEnvelope,,,,plic,plic,http://rs.tdwg.org/plic/terms/
2022-11-08T20:28:25-06:00,Feeding,http://rs.tdwg.org/plic/terms/,2022-11-08,2022-11-08,,,,,Feeding,Information related to the food supply for the development and sustenance of the individual and/or its offspring.,,,http://www.w3.org/2000/01/rdf-schema#Class,,Feeding,/Dataset/TaxonRecord/NaturalHistory/Feeding,,,,plic,plic,http://rs.tdwg.org/plic/terms/
2022-11-08T20:28:25-06:00,Synonyms,http://rs.tdwg.org/plic/terms/,2022-11-08,2022-11-08,,,,,synonyms,Different names for this taxon.,,,http://www.w3.org/2000/01/rdf-schema#Class,,NomenclatureAndClassification,/Dataset/TaxonRecord/NomenclatureAndClassification/Synonyms,,,,plic,plic,http://rs.tdwg.org/plic/terms/
2022-11-08T20:28:25-06:00,BirthRate,http://rs.tdwg.org/plic/terms/,2022-11-08,2022-11-08,,,,,Birth rate,Ratio of births to the total number of individuals in a population in a time period.,,,http://www.w3.org/1999/02/22-rdf-syntax-ns#Property,,DemographyAndThreat,/Dataset/TaxonRecord/DemographyAndThreat/PopulationBiology/PopulationBiologyAtomized/BirthRate,,,,plic,plic,http://rs.tdwg.org/plic/terms/
2022-11-08T20:28:25-06:00,NumberIndividualsPerObservation,http://rs.tdwg.org/plic/terms/,2022-11-08,2022-11-08,,,,,Number individuals per observation,Mean number of individuals per observation event or unit.,,,http://www.w3.org/1999/02/22-rdf-syntax-ns#Property,,DemographyAndThreat,/Dataset/TaxonRecord/DemographyAndThreat/PopulationBiology/PopulationBiologyAtomized/NumberIndividualsPerObservation,,,,plic,plic,http://rs.tdwg.org/plic/terms/
2022-11-08T20:28:25-06:00,AverageDensity,http://rs.tdwg.org/plic/terms/,2022-11-08,2022-11-08,,,,,Average density,Average of the densities obtained for a population.,,,http://www.w3.org/1999/02/22-rdf-syntax-ns#Property,,DemographyAndThreat,/Dataset/TaxonRecord/DemographyAndThreat/PopulationBiology/PopulationBiologyAtomized/AverageDensity,,,,plic,plic,http://rs.tdwg.org/plic/terms/
2022-11-08T20:28:25-06:00,PopulationTrend,http://rs.tdwg.org/plic/terms/,2022-11-08,2022-11-08,,,,,Population trend,"Changes of a population over time and can include changes in  distribution, biogeography (e.g., size of population), life-history (e.g., birth and death rates), etc.",,,http://www.w3.org/1999/02/22-rdf-syntax-ns#Property,,DemographyAndThreat,/Dataset/TaxonRecord/DemographyAndThreat/PopulationBiology/PopulationBiologyAtomized/PopulationTrend,,,,plic,plic,http://rs.tdwg.org/plic/terms/
2022-11-08T20:28:25-06:00,Recruitment,http://rs.tdwg.org/plic/terms/,2022-11-08,2022-11-08,,,,,Recruitment,"Information on the process by which young individuals (e.g., seedlings, larvae, propagules) become part of the adult population. It can be rate, scale, a description, etc.",,,http://www.w3.org/1999/02/22-rdf-syntax-ns#Property,,DemographyAndThreat,/Dataset/TaxonRecord/DemographyAndThreat/PopulationBiology/PopulationBiologyAtomized/Recruitment,,,,plic,plic,http://rs.tdwg.org/plic/terms/
2022-11-08T20:28:25-06:00,PopulationGrowthRate,http://rs.tdwg.org/plic/terms/,2022-11-08,2022-11-08,,,,,Population growth rate,"Growth rate of a population in a given time period, based on births, deaths, emigration and immigration.",,,http://www.w3.org/1999/02/22-rdf-syntax-ns#Property,,DemographyAndThreat,/Dataset/TaxonRecord/DemographyAndThreat/PopulationBiology/PopulationBiologyAtomized/PopulationGrowthRate,,,,plic,plic,http://rs.tdwg.org/plic/terms/
2022-11-08T20:28:25-06:00,Emigration,http://rs.tdwg.org/plic/terms/,2022-11-08,2022-11-08,,,,,Emigration,Information on  individuals leaving a population.,,,http://www.w3.org/1999/02/22-rdf-syntax-ns#Property,,DemographyAndThreat,/Dataset/TaxonRecord/DemographyAndThreat/PopulationBiology/PopulationBiologyAtomized/Emigration,,,,plic,plic,http://rs.tdwg.org/plic/terms/
2022-11-08T20:28:25-06:00,Immigration,http://rs.tdwg.org/plic/terms/,2022-11-08,2022-11-08,,,,,Immigration,Information on individuals entering a population.,,,http://www.w3.org/1999/02/22-rdf-syntax-ns#Property,,DemographyAndThreat,/Dataset/TaxonRecord/DemographyAndThreat/PopulationBiology/PopulationBiologyAtomized/Immigration,,,,plic,plic,http://rs.tdwg.org/plic/terms/
2022-11-08T20:28:25-06:00,DescriptionLifeStages,http://rs.tdwg.org/plic/terms/,2022-11-08,2022-11-08,,,,,Description life stages,Sex/age categories or life stages of a species; can be size in the case of plants.,,,http://www.w3.org/1999/02/22-rdf-syntax-ns#Property,,DemographyAndThreat,/Dataset/TaxonRecord/DemographyAndThreat/PopulationBiology/PopulationBiologyAtomized/DescriptionLifeStages,,,,plic,plic,http://rs.tdwg.org/plic/terms/
2022-11-08T20:28:25-06:00,ProportionIndividualsPerStageLife,http://rs.tdwg.org/plic/terms/,2022-11-08,2022-11-08,,,,,ProportionIndividuals per stage life,Percentage of individuals that belong to each life stage in a population.,,,http://www.w3.org/1999/02/22-rdf-syntax-ns#Property,,DemographyAndThreat,/Dataset/TaxonRecord/DemographyAndThreat/PopulationBiology/PopulationBiologyAtomized/ProportionIndividualsPerStageLife,,,,plic,plic,http://rs.tdwg.org/plic/terms/
2022-11-08T20:28:25-06:00,CarryingCapacity,http://rs.tdwg.org/plic/terms/,2022-11-08,2022-11-08,,,,,Carrying capacity,Maximum population density possible as limited by the resources available for the population in the absence of predators and parasites.,,,http://www.w3.org/1999/02/22-rdf-syntax-ns#Property,,DemographyAndThreat,/Dataset/TaxonRecord/DemographyAndThreat/PopulationBiology/PopulationBiologyAtomized/CarryingCapacity,,,,plic,plic,http://rs.tdwg.org/plic/terms/
2022-11-08T20:28:25-06:00,AbundanceData,http://rs.tdwg.org/plic/terms/,2022-11-08,2022-11-08,,,,,AbundanceData,The relative representation of a species population in relation to other species or multiple species in a particular territory.,,,http://www.w3.org/1999/02/22-rdf-syntax-ns#Property,,DemographyAndThreat,/Dataset/TaxonRecord/DemographyAndThreat/PopulationBiology/PopulationBiologyAtomized/AbundanceData,,,,plic,plic,http://rs.tdwg.org/plic/terms/
2022-11-08T20:28:25-06:00,DensityData,http://rs.tdwg.org/plic/terms/,2022-11-08,2022-11-08,,,,,DensityData,Population size in relation to a defined space unit.,,,http://www.w3.org/1999/02/22-rdf-syntax-ns#Property,,DemographyAndThreat,/Dataset/TaxonRecord/DemographyAndThreat/PopulationBiology/PopulationBiologyAtomized/DensityData,,,,plic,plic,http://rs.tdwg.org/plic/terms/
2022-11-08T20:28:25-06:00,PatternDistribution,http://rs.tdwg.org/plic/terms/,2022-11-08,2022-11-08,,,,,Pattern distribution,The spatial arrangement of the individuals of a population in the territory it occupies.,,,http://www.w3.org/1999/02/22-rdf-syntax-ns#Property,,DemographyAndThreat,/Dataset/TaxonRecord/DemographyAndThreat/PopulationBiology/PopulationBiologyAtomized/PatternDistribution,,,,plic,plic,http://rs.tdwg.org/plic/terms/
2022-11-08T20:28:25-06:00,Size,http://rs.tdwg.org/plic/terms/,2022-11-08,2022-11-08,,,,,Size,Number of individual organisms in a population.,,,http://www.w3.org/1999/02/22-rdf-syntax-ns#Property,,DemographyAndThreat,/Dataset/TaxonRecord/DemographyAndThreat/PopulationBiology/PopulationBiologyAtomized/Size,,,,plic,plic,http://rs.tdwg.org/plic/terms/
2022-11-08T20:28:25-06:00,SexRatio,http://rs.tdwg.org/plic/terms/,2022-11-08,2022-11-08,,,,,SexRatio,Relative number of males to females in a population.,,,http://www.w3.org/1999/02/22-rdf-syntax-ns#Property,,DemographyAndThreat,/Dataset/TaxonRecord/DemographyAndThreat/PopulationBiology/PopulationBiologyAtomized/SexRatio,,,,plic,plic,http://rs.tdwg.org/plic/terms/
2022-11-08T20:28:25-06:00,Fecundity,http://rs.tdwg.org/plic/terms/,2022-11-08,2022-11-08,,,,,Fecundity,"In the context of a population, is the combined maximum potential of its individuals to produce offspring.",,,http://www.w3.org/1999/02/22-rdf-syntax-ns#Property,,DemographyAndThreat,/Dataset/TaxonRecord/DemographyAndThreat/PopulationBiology/PopulationBiologyAtomized/Fecundity,,,,plic,plic,http://rs.tdwg.org/plic/terms/
2022-11-08T20:28:25-06:00,MortalityRate,http://rs.tdwg.org/plic/terms/,2022-11-08,2022-11-08,,,,,Mortality rate,Probability of dying; the ratio between the number of deaths in a given time interval to the number of subjects alive at the start of this interval.,,,http://www.w3.org/1999/02/22-rdf-syntax-ns#Property,,DemographyAndThreat,/Dataset/TaxonRecord/DemographyAndThreat/PopulationBiology/PopulationBiologyAtomized/MortalityRate,,,,plic,plic,http://rs.tdwg.org/plic/terms/
2022-11-08T20:28:25-06:00,Revision,http://rs.tdwg.org/plic/terms/,2022-11-08,2022-11-08,,,,,Revision,"Creators, revision status and dates of the record.",,,http://www.w3.org/2000/01/rdf-schema#Class,,Metadata,/Dataset/TaxonRecord/RecordMetadata/Revision,,,,plic,plic,http://rs.tdwg.org/plic/terms/
2022-11-08T20:28:25-06:00,synonymsAtomized,http://rs.tdwg.org/plic/terms/,2022-11-08,2022-11-08,,,,,atomized synonyms,list of synonyms in a structured format.,,tsc:ScientificName,http://www.w3.org/2000/01/rdf-schema#Class,,NomenclatureAndClassification,/Dataset/TaxonRecord/NomenclatureAndClassification/Synonyms/SynonymsAtomized,,,,plic,plic,http://rs.tdwg.org/plic/terms/
2022-11-08T20:28:25-06:00,synonymsType,http://rs.tdwg.org/plic/terms/,2022-11-08,2022-11-08,,,,,synonyms type,"A type of sequence of sequences of zero or more Atomized and Unstructured synonyms, each one with their optional ancillary data.",,"Los ""Type"" los eliminamos ¿no? (FP)",http://www.w3.org/2000/01/rdf-schema#Class,,NomenclatureAndClassification,,,,,plic,plic,http://rs.tdwg.org/plic/terms/
2022-11-08T20:28:25-06:00,FullDescription,http://rs.tdwg.org/plic/terms/,2022-11-08,2022-11-08,,,,,Full Description,"Complete and detailed account of the taxonomic and systematic characters, i.e. those that define and allow to recognize an organism.",,,http://www.w3.org/2000/01/rdf-schema#Class,,TaxonomicDescription,/Dataset/TaxonRecord/TaxonomicDescription/FullDescription,,,,plic,plic,http://rs.tdwg.org/plic/terms/
2022-11-08T20:28:25-06:00,BaseElements,http://rs.tdwg.org/plic/terms/,2022-11-08,2022-11-08,,,,,Base Elements,Basic information to identify the record.,,,http://www.w3.org/2000/01/rdf-schema#Class,,Metadata,/Dataset/TaxonRecord/BaseElements,,,,plic,plic,http://rs.tdwg.org/plic/terms/
2022-11-08T20:28:25-06:00,HabitatAndDistribution,http://rs.tdwg.org/plic/terms/,2022-11-08,2022-11-08,,,,,Habitat And Distribution,Distribution of the species.,,,http://www.w3.org/2000/01/rdf-schema#Class,,HabitatAndDistribution,/Dataset/TaxonRecord/HabitatAndDistribution,,,,plic,plic,http://rs.tdwg.org/plic/terms/
2022-11-08T20:28:25-06:00,IdentificationKeys,http://rs.tdwg.org/plic/terms/,2022-11-08,2022-11-08,,,,,Identification Keys,"Tool for the identification of organisms, comprising a series of steps, each of which represents a question about one or more characters of the organism. Each step offers multiple alternatives, choosing one of them will lead us to the next step until ending, finally, in the name of the organism.",,"Most printed keys have only two alternatives, so called dichotomous keys. A taxon includes a key or an identification of key in the subordinate taxa. If we are in a register of a genus, this register would include the keys of the species that this register includes, and if it's one specie, then it would include the key of the infraspecific rank (For plants: subspecies, variety forms)",http://www.w3.org/2000/01/rdf-schema#Class,,TaxonomicDescription,/Dataset/TaxonRecord/TaxonomicDescription/IdentificationKeys,,,,plic,plic,http://rs.tdwg.org/plic/terms/
2022-11-08T20:28:25-06:00,Invasiveness,http://rs.tdwg.org/plic/terms/,2022-11-08,2022-11-08,,,,,Invasiveness,"Information about invasive exotic species that could threaten to ecosystem, habitats and species.",,,http://www.w3.org/2000/01/rdf-schema#Class,,Invasiveness,/Dataset/TaxonRecord/Invasiveness,,,,plic,plic,http://rs.tdwg.org/plic/terms/
2022-11-08T20:28:25-06:00,NaturalHistory,http://rs.tdwg.org/plic/terms/,2022-11-08,2022-11-08,,,,,Natural History,"Relevant descriptive information about the species: Life Form, Life Cycle, Reproduction, Annual Cycles, Feeding, Dispersal, Behavior, Interactions, Molecular Data, Migratory, Ecological Significance, Miscellaneous Details, Environmental Envelope and Ancillary Data.",,,http://www.w3.org/2000/01/rdf-schema#Class,,NaturalHistory,/Dataset/TaxonRecord/NaturalHistory,,,,plic,plic,http://rs.tdwg.org/plic/terms/
2022-11-08T20:28:25-06:00,RecordMetadata,http://rs.tdwg.org/plic/terms/,2022-11-08,2022-11-08,,,,,Record Metadata,"This element includes the information about the Version, Revision,the language and target audiences of the Taxon Record.",,,http://www.w3.org/2000/01/rdf-schema#Class,,Metadata,/Dataset/TaxonRecord/RecordMetadata,,,,plic,plic,http://rs.tdwg.org/plic/terms/
2022-11-08T20:28:25-06:00,taxonomicalDescription,http://rs.tdwg.org/plic/terms/,2022-11-08,2022-11-08,,,,,taxonomic description,Description of Taxon.,,"Description of Taxon: Brief description, Full description, Identification keys and Ancillary Data",http://www.w3.org/2000/01/rdf-schema#Class,,TaxonomicDescription,,,,,plic,plic,http://rs.tdwg.org/plic/terms/
2022-11-08T20:28:25-06:00,ExtentOfOccurrence,http://rs.tdwg.org/plic/terms/,2022-11-08,2022-11-08,,,,,Extent of occurrence,"Area contained within the shortest continuous imaginary boundary which can be drawn to encompass all the known, inferred or projected sites of present occurrence of a taxon, excluding cases of vagrancy.",,,http://www.w3.org/1999/02/22-rdf-syntax-ns#Property,,DemographyAndThreat,/Dataset/TaxonRecord/DemographyAndThreat/Territory/TerritoryAtomized/ExtentOfOccurrence,,,,plic,plic,http://rs.tdwg.org/plic/terms/
2022-11-08T20:28:25-06:00,AreaOfOccupancy,http://rs.tdwg.org/plic/terms/,2022-11-08,2022-11-08,,,,,Area of occupancy,"Area within its 'extent of occurrence' (see EOO) which is occupied by a taxon, excluding cases of vagrancy. The measure reflects the fact that a taxon will not usually occur throughout the area of its extent of occurrence, which may contain unsuitable or unoccupied habitats.",,,http://www.w3.org/1999/02/22-rdf-syntax-ns#Property,,DemographyAndThreat,/Dataset/TaxonRecord/DemographyAndThreat/Territory/TerritoryAtomized/AreaOfOccupancy,,,,plic,plic,http://rs.tdwg.org/plic/terms/
2022-11-08T20:28:25-06:00,DirectThreats,http://rs.tdwg.org/plic/terms/,2022-11-08,2022-11-08,,,,,Direct Threats,"Direct threats are the proximate human activities or processes that have caused, are causing, or may cause the destruction, degradation, and/or impairment of biodiversity targets. Direct threats are synonymous with sources of stress and proximate pressures.",,"Examples: unsustainable fishing or logging. Threats can be past (historical), ongoing, and/or likely to occur in the future.",http://www.w3.org/2000/01/rdf-schema#Class,,DemographyAndThreat,/Dataset/TaxonRecord/DemographyAndThreat/DirectThreats,,,,plic,plic,http://rs.tdwg.org/plic/terms/
2022-11-08T20:28:25-06:00,DirectThreatAtomized,http://rs.tdwg.org/plic/terms/,2022-11-08,2022-11-08,,,,,Atomized Direct Threat,directThreats element in structured format. ,,,http://www.w3.org/2000/01/rdf-schema#Class,,DemographyAndThreat,/Dataset/TaxonRecord/DemographyAndThreat/DirectThreats/DirectThreatAtomized,,,,plic,plic,http://rs.tdwg.org/plic/terms/
2022-11-08T20:28:25-06:00,TrophicStrategy,http://rs.tdwg.org/plic/terms/,2022-11-08,2022-11-08,,,,,Trophic Strategy,"Tactic used to obtain energy or nutrients. A controlled vocabulary is  recommended. e.g. Chemosynthetic organisms, Photosynthetic  organisms, Parasites, Decomposers, Suspension feeders, Substrate feeders,   Grazers, Fluid-feeders, Predators...",,,http://www.w3.org/2004/02/skos/core#ConceptScheme,,Feeding,/Dataset/TaxonRecord/NaturalHistory/Feeding/FeedingAtomized/Thropic/TrophicStrategy,,,,plic,plic,http://rs.tdwg.org/plic/terms/
2022-11-08T20:28:25-06:00,TrophicStrategyRemarks,http://rs.tdwg.org/plic/terms/,2022-11-08,2022-11-08,,,,,Trophic Strategy Remarks,Information notes about specific feeding strategies.,,,http://www.w3.org/2004/02/skos/core#ConceptScheme,,Feeding,/Dataset/TaxonRecord/NaturalHistory/Feeding/FeedingAtomized/Thropic/TrophicStrategyRemarks,,,,plic,plic,http://rs.tdwg.org/plic/terms/
2022-11-08T20:28:25-06:00,UsesUnstructured,http://rs.tdwg.org/plic/terms/,2022-11-08,2022-11-08,,,,,Unstructured Uses,Uses in a unstructured format.,,,http://www.w3.org/1999/02/22-rdf-syntax-ns#Property,,UsesManagementAndConservation,/Dataset/TaxonRecord/UsesManagementAndConservation/Uses/UsesUnstructured,,,,plic,plic,http://rs.tdwg.org/plic/terms/
2022-11-08T20:28:25-06:00,SourceOfInformation,http://rs.tdwg.org/plic/terms/,2022-11-08,2022-11-08,,,,,Source of Information,"Where does the observation come from? Reference citations should be given. Where appropriate, voucher specimen details should be provided (collector, number, date, herbarium) as well as details of the recorded informant (name, gender, approximate age, occupation, ethnic identity, locality and spoken language).",,,http://www.w3.org/2000/01/rdf-schema#Class,,UsesManagementAndConservation,/Dataset/TaxonRecord/UsesManagementAndConservation/Uses/UsesAtomized/SourceOfInformation,,,,plic,plic,http://rs.tdwg.org/plic/terms/
2022-11-08T20:28:25-06:00,Use-Value,http://rs.tdwg.org/plic/terms/,2022-11-08,2022-11-08,,,,,Use-Value,"What is the plant used for, or what negative values does it have.",,,http://www.w3.org/1999/02/22-rdf-syntax-ns#Property,,UsesManagementAndConservation,/Dataset/TaxonRecord/UsesManagementAndConservation/Uses/UsesAtomized/Use-Value,,,,plic,plic,http://rs.tdwg.org/plic/terms/
2022-11-08T20:28:25-06:00,PartUsed,http://rs.tdwg.org/plic/terms/,2022-11-08,2022-11-08,,,,,Part Used,"Acc. TDWG Economic Botany. Which plant parts are used, or have any negative values.",,,http://www.w3.org/1999/02/22-rdf-syntax-ns#Property,,UsesManagementAndConservation,/Dataset/TaxonRecord/UsesManagementAndConservation/Uses/UsesAtomized/PartUsed,,,,plic,plic,http://rs.tdwg.org/plic/terms/
2022-11-08T20:28:25-06:00,Users,http://rs.tdwg.org/plic/terms/,2022-11-08,2022-11-08,,,,,Users,Acc. TDWG Economic Botany. The user group who recognizes the value and/or use of the plant.,,,http://www.w3.org/1999/02/22-rdf-syntax-ns#Property,,UsesManagementAndConservation,/Dataset/TaxonRecord/UsesManagementAndConservation/Uses/UsesAtomized/Users,,,,plic,plic,http://rs.tdwg.org/plic/terms/
2022-11-08T20:28:25-06:00,Organisms,http://rs.tdwg.org/plic/terms/,2022-11-08,2022-11-08,,,,,Organisms,Acc. TDWG Economic Botany. Organisms which use the plant/plant parts.,,,http://www.w3.org/1999/02/22-rdf-syntax-ns#Property,,UsesManagementAndConservation,/Dataset/TaxonRecord/UsesManagementAndConservation/Uses/UsesAtomized/Organisms,,,,plic,plic,http://rs.tdwg.org/plic/terms/
2022-11-08T20:28:25-06:00,VernacularNameUseAnnotations,http://rs.tdwg.org/plic/terms/,2022-11-08,2022-11-08,,,,,Vernacular Name Use Annotations,"Acc. TDWG Economic Botany. The name of the taxon must be distinguished from the name of the plant parts, the names of any processing stages, and the final product name. Names used in trade should be identified. It should also be mentioned if any vernacular name refers to more than one taxon. The use of some names may be restricted to a time of year or occasion, or have sacred connotations. The language or dialect to which the names belong should be stated along with details of the ethnic group. Care should be taken with transliteration into the Roman alphabet; if a standard system exists, use it and note which one it is.",,,http://www.w3.org/1999/02/22-rdf-syntax-ns#Property,,UsesManagementAndConservation,/Dataset/TaxonRecord/UsesManagementAndConservation/Uses/UsesAtomized/VernacularNameUseAnnotations,,,,plic,plic,http://rs.tdwg.org/plic/terms/
2022-11-08T20:28:25-06:00,ProductionDetails,http://rs.tdwg.org/plic/terms/,2022-11-08,2022-11-08,,,,,Production Details,"Definition:        Acc. TDWG Economic Botany. (where relevant). Give details of protection, cultivation, harvesting, yields, processing and storage methods used and take note of special tools, timing etc.",,,http://www.w3.org/1999/02/22-rdf-syntax-ns#Property,,UsesManagementAndConservation,/Dataset/TaxonRecord/UsesManagementAndConservation/Uses/UsesAtomized/ProductionDetails,,,,plic,plic,http://rs.tdwg.org/plic/terms/
